{
  "scenario_id": "golden-scenario",
  "benchmark_version": "1",
  "trace_set_ids": [
    "golden:spawn"
  ],
  "trace_hashes": {
    "golden:spawn": "7f1b3ae257b4c2a8ca22d5652267fbf3acf8e397715f6cf02ec31a7e3ab18952"
  },
  "workload_version": "1",
  "model_input_contract": {
    "model_identity": "synthetic-conformance-model",
    "tokenizer_hash": "bd3d95b68ea41c9245552c588b7277a3b3f4d4012b3920e85016cc4350f3c226",
    "chat_template_hash": "b8bb728594c9c4a35f59a5d496dd2920b27bd2f784259e9c2ccdbdfd7745f13a",
    "generation_parameters": {
      "temperature": 0.0
    }
  },
  "replay": {
    "fidelity_mode": "length_locked",
    "tool_replay_policy": "recorded",
    "external_delay_policy": "deterministic",
    "cache_policy": "reuse_scope_isolated"
  },
  "root_arrival": {
    "mode": "trace_offsets",
    "arrival_rate": null,
    "concurrency": 1,
    "random_seed": 17,
    "task_mix": {
      "golden:spawn": 1.0
    }
  },
  "measurement": {
    "warmup_policy": "none",
    "task_count": 1,
    "task_slo_sec": 10.0,
    "slo_attainment_target": 1.0
  },
  "validity": {
    "error_handling": "invalidate",
    "cancellation_policy": "invalidate",
    "context_overflow_policy": "invalidate",
    "truncation_policy": "forbid"
  },
  "scenario_version": "masbench.scenario/1.0.0",
  "resolved_cache_scope_salts": {
    "scope:spawn-root": "1b3b59243e76270815c9a924",
    "scope:spawn-worker": "f1031395bb1bd40fe588a979"
  },
  "resolved_request_contracts": {
    "op:dispatch": {
      "request_hash": "397586277592d11f02f355acb2cc2a54f67e73af022967f3dbc0606cb543b3cf",
      "input_token_ids": [
        123,
        34,
        109,
        97,
        120,
        95,
        116,
        111,
        107,
        101,
        110,
        115,
        34,
        58,
        51,
        44,
        34,
        109,
        101,
        115,
        115,
        97,
        103,
        101,
        115,
        34,
        58,
        91,
        123,
        34,
        99,
        111,
        110,
        116,
        101,
        110,
        116,
        34,
        58,
        34,
        91,
        77,
        65,
        83,
        66,
        69,
        78,
        67,
        72,
        95,
        67,
        65,
        67,
        72,
        69,
        95,
        83,
        67,
        79,
        80,
        69,
        58,
        49,
        98,
        51,
        98,
        53,
        57,
        50,
        52,
        51,
        101,
        55,
        54,
        50,
        55,
        48,
        56,
        49,
        53,
        99,
        57,
        97,
        57,
        50,
        52,
        93,
        92,
        110,
        77,
        65,
        83,
        66,
        101,
        110,
        99,
        104,
        32,
        115,
        121,
        110,
        116,
        104,
        101,
        116,
        105,
        99,
        32,
        103,
        111,
        108,
        100,
        101,
        110,
        32,
        116,
        114,
        97,
        99,
        101,
        46,
        34,
        44,
        34,
        114,
        111,
        108,
        101,
        34,
        58,
        34,
        115,
        121,
        115,
        116,
        101,
        109,
        34,
        125,
        44,
        123,
        34,
        99,
        111,
        110,
        116,
        101,
        110,
        116,
        34,
        58,
        34,
        82,
        101,
        99,
        111,
        114,
        100,
        101,
        100,
        32,
        100,
        111,
        119,
        110,
        115,
        116,
        114,
        101,
        97,
        109,
        32,
        105,
        110,
        112,
        117,
        116,
        32,
        102,
        111,
        114,
        32,
        111,
        112,
        58,
        100,
        105,
        115,
        112,
        97,
        116,
        99,
        104,
        59,
        32,
        100,
        101,
        112,
        101,
        110,
        100,
        101,
        110,
        99,
        105,
        101,
        115,
        61,
        46,
        34,
        44,
        34,
        114,
        111,
        108,
        101,
        34,
        58,
        34,
        117,
        115,
        101,
        114,
        34,
        125,
        93,
        44,
        34,
        109,
        111,
        100,
        101,
        108,
        34,
        58,
        34,
        115,
        121,
        110,
        116,
        104,
        101,
        116,
        105,
        99,
        45,
        99,
        111,
        110,
        102,
        111,
        114,
        109,
        97,
        110,
        99,
        101,
        45,
        109,
        111,
        100,
        101,
        108,
        34,
        44,
        34,
        116,
        101,
        109,
        112,
        101,
        114,
        97,
        116,
        117,
        114,
        101,
        34,
        58,
        48,
        46,
        48,
        125
      ],
      "input_token_count": 283,
      "reuse_scope_id": "scope:spawn-root"
    },
    "op:worker": {
      "request_hash": "2f00cdb84c0a1edc395ffc07d1290d214705cb4d7cd943176c3571e70dee7225",
      "input_token_ids": [
        123,
        34,
        109,
        97,
        120,
        95,
        116,
        111,
        107,
        101,
        110,
        115,
        34,
        58,
        52,
        44,
        34,
        109,
        101,
        115,
        115,
        97,
        103,
        101,
        115,
        34,
        58,
        91,
        123,
        34,
        99,
        111,
        110,
        116,
        101,
        110,
        116,
        34,
        58,
        34,
        91,
        77,
        65,
        83,
        66,
        69,
        78,
        67,
        72,
        95,
        67,
        65,
        67,
        72,
        69,
        95,
        83,
        67,
        79,
        80,
        69,
        58,
        102,
        49,
        48,
        51,
        49,
        51,
        57,
        53,
        98,
        98,
        49,
        98,
        100,
        52,
        48,
        102,
        101,
        53,
        56,
        56,
        97,
        57,
        55,
        57,
        93,
        92,
        110,
        77,
        65,
        83,
        66,
        101,
        110,
        99,
        104,
        32,
        115,
        121,
        110,
        116,
        104,
        101,
        116,
        105,
        99,
        32,
        103,
        111,
        108,
        100,
        101,
        110,
        32,
        116,
        114,
        97,
        99,
        101,
        46,
        34,
        44,
        34,
        114,
        111,
        108,
        101,
        34,
        58,
        34,
        115,
        121,
        115,
        116,
        101,
        109,
        34,
        125,
        44,
        123,
        34,
        99,
        111,
        110,
        116,
        101,
        110,
        116,
        34,
        58,
        34,
        82,
        101,
        99,
        111,
        114,
        100,
        101,
        100,
        32,
        100,
        111,
        119,
        110,
        115,
        116,
        114,
        101,
        97,
        109,
        32,
        105,
        110,
        112,
        117,
        116,
        32,
        102,
        111,
        114,
        32,
        111,
        112,
        58,
        119,
        111,
        114,
        107,
        101,
        114,
        59,
        32,
        100,
        101,
        112,
        101,
        110,
        100,
        101,
        110,
        99,
        105,
        101,
        115,
        61,
        111,
        112,
        58,
        100,
        105,
        115,
        112,
        97,
        116,
        99,
        104,
        46,
        34,
        44,
        34,
        114,
        111,
        108,
        101,
        34,
        58,
        34,
        117,
        115,
        101,
        114,
        34,
        125,
        93,
        44,
        34,
        109,
        111,
        100,
        101,
        108,
        34,
        58,
        34,
        115,
        121,
        110,
        116,
        104,
        101,
        116,
        105,
        99,
        45,
        99,
        111,
        110,
        102,
        111,
        114,
        109,
        97,
        110,
        99,
        101,
        45,
        109,
        111,
        100,
        101,
        108,
        34,
        44,
        34,
        116,
        101,
        109,
        112,
        101,
        114,
        97,
        116,
        117,
        114,
        101,
        34,
        58,
        48,
        46,
        48,
        125
      ],
      "input_token_count": 292,
      "reuse_scope_id": "scope:spawn-worker"
    }
  },
  "scenario_hash": "83c8af44a69f79d04d997d6d01220d13977bcd9083267e0da5b3d96f0cb58375"
}